BOM.csv

Category,Quantity,Part Name,Type,Link,Price
Power,1,14awg Wire 30ft,15ft 14awg,https://www.amazon.com/gp/product/B0D969PF5C/,$9.98
Power,1,Power Supply Cable 3-Prong 1.2m,USA,https://www.aliexpress.com/item/3256807060355465.html,$3.49
Power,1,IEC320 C14/C13 Panel Socket,Type 4 / China Mainland,https://www.aliexpress.com/item/3256808473935736.html,$1.33
Power,1,24V 7Ah LiFePO4 Rechargeable Battery with BMS,24V / 7Ah,https://www.amazon.com/gp/product/B0DSRT3BB8/,$42.99
Power,1,MEAN WELL LRS-350-24,N/A,https://www.amazon.com/gp/product/B013ETVO12/,$28.54
Power Delivery,1,PD65W fast charging module (Type-C),4pcs,https://www.aliexpress.com/item/3256806830457021.html,$4.19
Power Delivery,1,PD45W fast charging module (Type-C),45W,https://www.aliexpress.com/item/3256807318962557.html,$1.99
Power Delivery,2,PD30W fast charging module (Type-C),30W,https://www.aliexpress.com/item/3256807318962557.html,$1.95
Power Delivery,1,USB-A breakout female board,5PCS,https://www.aliexpress.com/item/3256807147268432.html,$1.24
Power Delivery,1,USB-A QC2.0/3.0 buck converter module,2 Channel,https://www.aliexpress.com/item/3256809395236306.html,$1.99
Power Delivery,3,120W USB-C to USB-C fast charging cable,Black C-C/2m,https://www.aliexpress.com/item/3256807024111085.html,$2.79
Power Delivery,4,120W USB-C to USB-A fast charging cable,Black A-C/2m,https://www.aliexpress.com/item/3256807024111085.html,$2.21
Power Delivery,1,NNBILI 100W USB C/A charging cable,100W USB C cable/1m,https://www.aliexpress.com/item/3256806737244284.html,$2.67
Modules,1,DC-DC adjustable buck converter XL4015,HW-083B 4pcs,https://www.aliexpress.com/item/3256806491709950.html,$5.07
Modules,1,Battery capacity indicator voltmeter,Color Screen/CHINA,https://www.aliexpress.com/item/3256804198482360.html,$4.46
Modules,5,CUSTOM Ideal Diode Module,N/A,https://github.com/lekangji/MacroUPS/tree/main/Ideal%20Diode,$29.12
Switches + Fuses,1,Rocker switch ON-OFF,Red 2Pin,https://www.aliexpress.com/item/2255800661582532.html,$0.76
Switches + Fuses,2,SPST waterproof toggle switch,N/A,https://www.aliexpress.com/item/3256808459598008.html,$2.89
Switches + Fuses,2,Circuit breaker switch fuse,10A/Other,https://www.aliexpress.com/item/3256805757815979.html,$1.63
Switches + Fuses,1,Circuit breaker switch fuse,15A/Other,https://www.aliexpress.com/item/3256805757815979.html,$1.89
Cooling,2,12V DC cooling fan,8025/12V,https://www.aliexpress.com/item/3256806120222119.html,$3.59
Cooling,3,Thermal switch temperature sensor 40C/H,40C/H (Normally Open),https://www.aliexpress.com/item/2251832786193672.html,$1.33
Cooling,1,Aluminum heatsink 15x15x15mm,15x15x15mm,https://www.aliexpress.com/item/3256803892794950.html,$4.38
Cooling,1,Aluminum heatsink 8.8x8.8x5mm,8.8x8.8x5mm,https://www.aliexpress.us/item/2251832663311102.html,$2.29

README.md

### Power

- 1x of `14awg Wire 30ft`, TYPE 15ft 14awg: [link](https://www.amazon.com/gp/product/B0D969PF5C/) – PRICE $9.98
- 1x of `Power Supply Cable 3-Prong 1.2m`, TYPE USA: [link](https://www.aliexpress.com/item/3256807060355465.html) – PRICE $3.49
- 1x of `IEC320 C14/C13 Panel Socket`, TYPE Type 4: [link](https://www.aliexpress.com/item/3256808473935736.html) – PRICE $1.33
- 1x of `24V 7Ah LiFePO4 Rechargeable Battery with BMS`, TYPE 24V / 7Ah: [link](https://www.amazon.com/gp/product/B0DSRT3BB8/) – PRICE $42.99
- 1x of `MEAN WELL LRS-350-24`, TYPE N/A: [link](https://www.amazon.com/gp/product/B013ETVO12/) – PRICE $28.54

### Power Delivery

- 1x of `PD65W fast charging module (Type-C)`, TYPE 4pcs: [link](https://www.aliexpress.com/item/3256806830457021.html) – PRICE $4.19
- 1x of `PD45W fast charging module (Type-C)`, TYPE 45W: [link](https://www.aliexpress.com/item/3256807318962557.html) – PRICE $1.99
- 2x of `PD30W fast charging module (Type-C)`, TYPE 30W: [link](https://www.aliexpress.com/item/3256807318962557.html) – PRICE $1.95
- 1x of `USB-A breakout female board`, TYPE 5PCS: [link](https://www.aliexpress.com/item/3256807147268432.html) – PRICE $1.24
- 1x of `USB-A QC2.0/3.0 buck converter module`, TYPE 2 Channel: [link](https://www.aliexpress.com/item/3256809395236306.html) – PRICE $1.99
- 4x of `120W USB-C to USB-C fast charging cable`, TYPE Black C-C/2m: [link](https://www.aliexpress.com/item/3256807024111085.html) – PRICE $2.79
- 4x of `120W USB-C to USB-A fast charging cable`, TYPE Black A-C/2m: [link](https://www.aliexpress.com/item/3256807024111085.html) – PRICE $2.21

### Modules

- 1x of `DC-DC adjustable buck converter XL4015`, TYPE HW-083B 4pcs: [link](https://www.aliexpress.com/item/3256806491709950.html) – PRICE $5.07
- 1x of `Battery capacity indicator voltmeter`, TYPE Color Screen/CHINA: [link](https://www.aliexpress.com/item/3256804198482360.html) – PRICE $4.46

### Switches + Fuses

- 1x of `Rocker switch ON-OFF`, TYPE Red 2Pin: [link](https://www.aliexpress.com/item/2255800661582532.html) – PRICE $0.76
- 2x of `SPST waterproof toggle switch`, TYPE N/A: [link](https://www.aliexpress.com/item/3256808459598008.html) – PRICE $2.89
- 2x of `Circuit breaker switch fuse`, TYPE 10A/Other: [link](https://www.aliexpress.com/item/3256805757815979.html) – PRICE $1.63
- 1x of `Circuit breaker switch fuse`, TYPE 15A/Other: [link](https://www.aliexpress.com/item/3256805757815979.html) – PRICE $1.89

### Cooling

- 2x of `12V DC cooling fan`, TYPE 8025/12V: [link](https://www.aliexpress.com/item/3256806120222119.html) – PRICE $3.59
- 3x of `Thermal switch temperature sensor 40C/H`, TYPE 40C/H (Normally Open): [link](https://www.aliexpress.com/item/2251832786193672.html) – PRICE $1.33
- 1x of `Aluminum heatsink 15x15x15mm`, TYPE 15x15x15mm: [link](https://www.aliexpress.com/item/3256803892794950.html) – PRICE $4.38
- 1x of `Aluminum heatsink 8.8x8.8x5mm`, TYPE 8.8x8.8x5mm: [link](https://www.aliexpress.us/item/2251832663311102.html) – PRICE $2.29